EGP_ID;SuperCategory;SubCategory;Level;Type;Guideword;Can-do statement;Example
562;MODALITY;would;B1;FORM;FORM: PAST NEGATIVE;Can use 'would not have' + '-ed' or 'wouldn’t have' + '-ed';"Without your help, I wouldn't have got this result. (Spain; B1 THRESHOLD; 2010; Spanish - European; Pass)

Had it not been for that day, she would not have met George. (Vietnam; B1 THRESHOLD; 2009; Vietnamese; Pass)"
563;MODALITY;would;B1;FORM;FORM: QUESTIONS;Can use question forms.;"Would you let me know what you think? (French, B1 THRESHOLD, Pass, 2011)

Would you please do me a favour? Could you go and collect the clothes for me? (Singhalese, B1 THRESHOLD, Pass, 2009)

Think of the fun you will have with your friends, the whole day hanging around, playing sports, eating ice cream. Wouldn't that be wonderful? (Swiss German, B1 THRESHOLD, Pass, 2008)

I think it would be fantastic, wouldn't it? (Italian, B1 THRESHOLD, Pass, 2008)"
564;MODALITY;would;B1;FORM;FORM: WITH ADVERBS;Can use an limited range of adverbs with 'would', including 'really', 'probably', 'certainly', 'definitely'.► adverbs;"I hope you will come soon, and I think that you would really enjoy it because is something different of what you are used to. (Peru; B1 THRESHOLD; 2004; Spanish - Latin American; Pass)

More over in my opinion it would probably be the best idea to choose the biggest school ... (Italy; B1 THRESHOLD; 2008; Italian; Pass)

I would definitely choose to live by the sea side! (Malaysia; B1 THRESHOLD; 2010; Chinese; Pass)"
574;NOUNS;noun phrases;B1;FORM;FORM: COMPLEX NOUN PHRASES WITH ADJECTIVES;Can form an increasing range of complex noun phrases with more than one adjective. ;"The Northeast is so beautiful and it's famous because of its white sandy beaches and the coconut trees. (Brazil; B1 THRESHOLD; 2004; Portuguese; Pass)

Last weekend I went to São Paulo to buy some winter clothes. I bought a white hooded jacket, a blue jumper, black gloves and a beautiful blue scarf. (Brazil; B1 THRESHOLD; 2010; Portuguese; Pass)

Inside there were three samples of a nasty purple liquid. (Peru; B1 THRESHOLD; 2006; Spanish - Latin American; Pass)

I know your company are offering an exciting new service in our area. (China; B1 THRESHOLD; 2007; Chinese; Pass)

He had beautiful green eyes, short, curly, red hair and he was wearing an elegant black suit with a red tie. (Mexico; B1 THRESHOLD; 2006; Spanish - Latin American; Pass)

You can walk along the streets and eat typical Spanish food in good restaurants. (Spain; B1 THRESHOLD; 2004; Spanish - European; Pass)"
575;NOUNS;noun phrases;B1;FORM;FORM: COMPLEX NOUN PHRASES WITH ADVERBS + ADJECTIVES;Can form complex noun phrases with adverb + adjective + noun. ;"It took us a very long time but it was a great fun! (Poland; B1 THRESHOLD; 2009; Polish; Pass)

They made really good friends. (Argentina; B1 THRESHOLD; 2008; Spanish - Latin American; Pass)"
577;NOUNS;noun phrases;B1;FORM;FORM: NOUN + PREPOSITIONAL PHRASES ;Can form complex noun phrases by using a prepositional phrase after the main noun in a noun phrase. ;"It was a beautiful red dress with blue flowers on the back. (Andorra; B1 THRESHOLD; 2010; French; Pass)

Yesterday a TV company came to our school to make a film about Bavarian pupils. (Germany; B1 THRESHOLD; 2008; German; Pass)

I don't spend too much time in front of the television, I just watch it twice a week and on Sundays morning. (Brazil; B1 THRESHOLD; 2007; Portuguese; Pass)

I received your letter and you asked me about the future of my town. (Brazil; B1 THRESHOLD; 2007; Portuguese; Pass)

I have to travel to Montevideo to see my doctor because I'm having some problems with my health. (Uruguay; B1 THRESHOLD; 2009; Spanish - Latin American; Pass)
"
580;NOUNS;noun phrases;B1;FORM;FORM: NOUN + 'OF' + POSSESSIVE PRONOUN ;Can form noun phrases with noun + 'of' + possessive pronouns. ;"… we always did everything together and couldn't stop laughing as she told me many funny stories and I told her lots of silly mistakes of mine. (Vietnam; B1 THRESHOLD; 2009; Vietnamese; Pass)

A colleague of mine has told me about a Swiss hotel in London. (Switzerland; B1 THRESHOLD; 2004; Swiss German; Fail)

I was looking for something special to do for my last week off and some schoolmates of mine invited me to join the cycling holiday. (Italy; B1 THRESHOLD; 2003; Italian; Pass)

I'm a fan of his, he is my favorite singer. (Turkey; B1 THRESHOLD; 2009; Turkish; Pass)

I want this dream of mine to come true. (India; B1 THRESHOLD; 2010; Panjabi; Pass)"
581;NOUNS;noun phrases;B1;FORM;FORM: FRIEND + 'OF' + POSSESSIVE DETERMINER + NOUN ;Can form noun phrases with 'a friend of' or 'friends of' + possessive determiner + noun.;"He is a friend of my husband. (Japan; B1 THRESHOLD; 1999; Japanese; Pass)

I just thought they were friends of my neighbour who were going to visit him. (B1 THRESHOLD; 2007; Polish; Pass)"
582;NOUNS;noun phrases;B1;FORM;FORM: COMPLEX NOUN PHRASE WITH POSSESSIVE '‘S' + NOUN;Can form complex noun phrases with noun phrase + 'of' + noun phrase + possessive determiner ''s' + noun phrase.;"I ran to the street and I saw the window of my neighbour's car was broken. (B1 THRESHOLD; 2007; Portuguese; Pass)

The subject of my boss's talk will be IT skills. (Spain; B1 THRESHOLD; 2002; Spanish - European; Pass)

My friend Ronald had been chosen to play the role of James Bond's son! (Italy; B1 THRESHOLD; 2008; Italian; Pass)

My best friend is called Sindi and we met at my brother's birthday. She is the sister of my brother's girlfriend so he invited her as well. (Bulgaria; B1 THRESHOLD; 2010; Bulgarian; Pass)

The delivery date should be the day of my friend's birthday. (B1 THRESHOLD; 2003; Pass)"
583;NOUNS;noun phrases;B1;FORM;FORM: NOUN PHRASE, NOUN PHRASE ;Can put two noun phrases together (in apposition) to refer to the same person or thing, usually separated by commas.;"Mr Miller, the Sales Director, will visit us next Thursday. (Germany; B1 THRESHOLD; 2001; German; Pass)

Yesterday my boyfriend and I decided to go on a cycling holiday to visit some places in the country near Eboli, the town where we live. (Italy; B1 THRESHOLD; 2003; Italian; Pass)

She has come with me and two more friends, Peter and Gorha. (Spain; B1 THRESHOLD; 2003; Spanish - European; Pass)

I spoke with her and she looks really happy, although a little sad because her best friend, Alison, did not pass the exam. (Spain; B1 THRESHOLD; 2004; Spanish - European; Pass)

A new employee, Mary Watts, has just joined our company. (China; B1 THRESHOLD; 2002; Chinese; Pass)"
584;NOUNS;noun phrases;B1;FORM;FORM: INDEFINITE PRONOUNS ;Can form noun phrases with an indefinite pronoun + adjective or clause. ;"We see each other every day and do something different every day. (B1 THRESHOLD; 2004; ; Pass)

You could bring something to drink. (Uruguay; B1 THRESHOLD; 2009; Spanish - Latin American; Fail)

But then there is nothing special to eat. (Germany; B1 THRESHOLD; 2006; German; Pass)"
586;NOUNS;types;B1;FORM;FORM: COMMON NOUNS;Can use an increasing range of common nouns. ;"When you're swimming you exercise all of your body. (2649025_2; PET; Cyprus; B1 THRESHOLD; 2009; Greek; Pass)

You just have to send me your design and I'll do the rest. (Peru; B1 THRESHOLD; 2006; Spanish - Latin American; Pass)

My heart was hurt and nobody will repair the damage. (Argentina; B1 THRESHOLD; 2004; Spanish - Latin American; Pass)
"
587;NOUNS;plural;B1;FORM;FORM: COLLECTIVE NOUNS;Can use collective nouns, usually with a singular verb, but also with a plural verb depending on whether the noun is perceived as a single group or collection of individuals.;"The staff is friendly and polite with guests and there are many sports activities. (Italy; B1 THRESHOLD; 2001; Italian; Pass)

After the spring break the whole staff have to start work at 7.15 am. (Switzerland; B1 THRESHOLD; 2007; Swiss German; Pass)

A TV company has decided to make a film in my high school because it's a normal secondary school. (Spain; B1 THRESHOLD; 2008; Spanish - European; Pass)

The crew were very interested in what the new school looked like and they were amazed at the colours we used to paint it. (Germany; B1 THRESHOLD; 2008; German; Pass)

Our company is interested in your company's services. (China; B1 THRESHOLD; 2006; Chinese; Pass)"
588;NOUNS;uncountable;B1;FORM;FORM: UNCOUNTABLE NOUNS;Can use an increasing range of uncountable nouns. ;"I think the countryside is better than the town centre, people get on more easily with each other. (Italy; B1 THRESHOLD; 2008; Spanish - Other; Pass)

Well, I love shopping for clothes because I love fashion. (Peru; B1 THRESHOLD; 2006; Spanish - Latin American; Pass)

I hope you can help me to find new accommodation as soon as is possible. (B1 THRESHOLD; 2007; Polish; Pass)

Firstly, you can admire lovely architecture and visit a museum about our history. (France; B1 THRESHOLD; 2004; French; Pass)"
589;NOUNS;uncountable;B1;FORM;FORM: WITH DETERMINERS, QUANTITY;Can use uncountable nouns with an increasing range of quantity words and phrases including 'much', 'a bit of', 'a little bit of', 'enough', 'further', 'plenty of', 'loads of'.  ►  Determiners: quantity;"I'm sure that your parents are looking forward to going with you to the beach, because they work a lot of hours during the year so they can't spend much time with you. (Spain; B1 THRESHOLD; 2008; Spanish - European; Pass)

I know you have sent me somebody to fix it but every time that it rains, at least a bit of water comes inside the house. (B1 THRESHOLD; 2007; Farsi; Pass)

I hope this little bit of advice can help you! (Germany; B1 THRESHOLD; 2008; German; Pass)

I prefer to buy only what I need because I don't have enough money. (Mexico; B1 THRESHOLD; 2006; Spanish - Latin American; Pass)

So I would like you to attend a meeting next week for further information. (China; B1 THRESHOLD; 2006; Chinese; Pass)

My Finance department is very busy, I have loads of work to finish. (India; B1 THRESHOLD; 2006; Bengali; Pass)"
591;PASSIVES;passives: form;B1;FORM;FORM: INFINITIVE ;Can use the passive infinitive after a limited number of forms including 'going to', 'have to', 'need to', 'want to'. ;"It is going to be shown this Friday. (B1 PET Turkish)

After that, they printed an authorisation, form which had to be signed by my parents because I'm not over eighteen. (Spain; B1 THRESHOLD; 2008; Spanish - European; Pass)

He wants to be informed about sales development by the end of November 2001. (B1 Switzerland German)"
592;PASSIVES;passives: form;B1;FORM;FORM: PAST SIMPLE, AFFIRMATIVE;Can use the past simple passive affirmative with a range of pronoun and noun subjects both singular and plural.;"It was written in a strange language that I tried to translate. (B1 Spanish - Latin American)

Next day, I heard that my neighbour's car was stolen. (B1 Polish)

They filmed the flowers and trees, and some pupils were interviewed about their work in the garden, too. (B1 German)"
593;PASSIVES;passives: form;B1;FORM;FORM: PRESENT CONTINUOUS, AFFIRMATIVE ;Can use the present continuous passive affirmative with a limited range of verbs.;"Did you know that the next Harry Potter movie is being filmed in my school? (Spain; B1 THRESHOLD; 2008; Catalan; Pass)

Why don't we stay at my house and visit Tokyo, where an interesting Japanese history exhibition is being held. (Japan; B1 THRESHOLD; 2004; Japanese; Pass)

As a result of that, Russia's economy is being followed by many experts. (Turkey; B1 THRESHOLD; 2008; Turkish; Pass)

They filmed a class where the clothes are being tested at the moment and they interviewed some people. (Germany; B1 THRESHOLD; 2008; German; Pass)"
594;PASSIVES;passives: form;B1;FORM;FORM: PRESENT SIMPLE, AFFIRMATIVE ;Can use the present simple passive affirmative with a range of pronoun and noun subjects.;"Our office is situated near the airport. (B1 Argentina ; Spanish - Latin American)

The walls are painted in a dark blue, and the floor is wood. (B1 Dutch) "
595;PASSIVES;passives: form;B1;FORM;FORM: PRESENT SIMPLE, NEGATIVE;Can use the present simple passive negative with a range of pronoun and noun subjects.;"The story is about a girl, who is not accepted in her class. (Germany; B1 THRESHOLD; 2008; German; Pass)

I think we should replace the printer, because it prints very slowly and the sheets aren't printed properly. (Switzerland; B1 THRESHOLD; 2009; Swiss German; Pass)"
596;PASSIVES;passives: form;B1;FORM;FORM: WITH VERBS TAKING TWO OBJECTS.;Can use the past simple passive with a limited range of verbs needing two objects, putting the indirect object in subject position. ;"So I was given a ticket for a train, running from Berlin to Munich. (Germany; B1 THRESHOLD; 2006; German; Pass)

We were lucky, because we were given another chance. (Yugoslavia; B1 THRESHOLD; 2006; Serbian; Pass)"
599;PASSIVES;get and have;B1;FORM;FORM: 'GET' + '-ED';Can form the 'get'-passive with a range of forms of 'get' + past participles.;"[talking about a mirror] I bought it because mine got broken, so I need it to see myself in it. (Mexico; B1 THRESHOLD; 2009; Spanish - Latin American; Pass)

You should be careful while you are crossing or you will get hurt. (India; B1 THRESHOLD; 2010; Tamil; Pass)

Last week my husband's car got stolen from our garage. (B1 THRESHOLD; 2007; Farsi; Pass)

As we have newly recruited staff, we want our staff to get trained effectively so that they can give their best to the Company. (India; B1 THRESHOLD; 2006; Gujarati; Fail)

We got paid well and I managed to save the most money for my studies. (Germany; B2 VANTAGE; 2004; German; Pass)"
600;PAST;past continuous;B1;FORM;FORM: NEGATIVE;Can use the negative form.;"He was not planning to become a professional player. (Spanish - Latin American, C2 MASTERY, Pass, 2004)

She was not feeling very well. (Portuguese, B2 VANTAGE, Pass, 1993)

I tried to phone her house, but her phone wasn't working. (Spanish - Latin American, B1 THRESHOLD, Pass, 2004)

I'm writing you this letter to tell you that we felt so bad when we heard you weren't working at the school any more. (Spanish - Latin American, B1 THRESHOLD, Pass, 2002)"
601;PAST;past continuous;B1;FORM;FORM: QUESTIONS;Can use the question form.;"Was my mother going to die? (Spain; B1 THRESHOLD; 2008; Spanish - European; Pass)

I couldnt see anybody, then there he was, my hero, my favorite singer Bob Dylan saying my name, but was he calling me? (Mexico; B1 THRESHOLD; 2006; Spanish - Latin American; Pass)

What were you doing? (Uzbekhistan (Republic of); B1 THRESHOLD; 2009; Russian; Pass)

[talking about a dream] Everything was strange. Why was I following a green fox? (Argentina; B1 THRESHOLD; 2009; Spanish - Latin American; Pass)"
602;PAST;past continuous;B1;FORM;FORM: WITH ADVERBS;Can use the past continuous with an increasing range of adverbs in the normal mid position. ;"He was still waiting at the traffic light. (Italian, B1 THRESHOLD, Pass, 2008)

He was actually acting like a ghost. (Chinese, B1 THRESHOLD, Pass, 2008)"
605;PAST;past perfect continuous;B1;FORM;FORM: AFFIRMATIVE;Can use the affirmative form. ;"I had been working on the project for over a year. (France; B1 THRESHOLD; 2004; French; Pass)

We had been waiting for hours. (Greece; B1 THRESHOLD; 2007; Greek; Pass)

I didn't need so much, because I'd been saving money for a few months. (Spain; B1 THRESHOLD; 2010; Spanish - European; Pass)"
609;PAST;past perfect simple;B1;FORM;FORM: AFFIRMATIVE ;Can use the affirmative form.;"I felt really sorry for you after I had read your last letter. (Poland; B1 THRESHOLD; 2008; Polish; Pass)

[?] I'd forgotten that I have an appointment with the doctor [?] (Spanish - Latin American; Peru; B1 THRESHOLD; Pass)"
610;PAST;past perfect simple;B1;FORM;FORM: NEGATIVE;Can use negative forms.;"The ABC Company called this morning to say that our company had not delivered the goods on time. (China; B1 THRESHOLD; 2002; Chinese; Pass)

I hadn't heard from her for two months. (Spain; B1 THRESHOLD; 2008; Spanish - European; Pass)
"
611;PAST;past perfect simple;B1;FORM;FORM: WITH ADVERBS ;Can use the past perfect simple with a limited range of adverbs (including 'never', 'ever', 'just', 'always', 'already') in the normal mid-position. ► adverbs;"It was the most beautiful one I had ever seen. (Italy; B1 THRESHOLD; 2008; Italian; Pass)

So, she came to America to see a relation she had never seen before, and she spent the money with me. (Spanish - Latin American; Argentina; B1 THRESHOLD; Pass)
I had just arrived from school when I saw the letter. (Portugal; B1 THRESHOLD; 2008; Portuguese; Pass)

I had always wanted to visit European cities and Paris was one of the easiest cities to get to from England. (Korea, South; B1 THRESHOLD; 1999; Korean; Pass)"
613;PAST;past simple;B1;FORM;FORM: AFFIRMATIVE;Can use the affirmative form with a wide range of verbs.;"I convinced some of my friends to come with me even if they don't like rap music. (Italy; B1 THRESHOLD; 2006; Italian; Pass)

Previously I faced many failures but I never gave up. (India; B1 THRESHOLD; 2010; Malayalam; Pass)

The cameraman filmed us during a lesson and later, walking to the playground. (Spain; B1 THRESHOLD; 2008; Catalan; Pass)"
614;PAST;past simple;B1;FORM;FORM: NEGATIVE;Can use the negative form with an increasing range of verbs.;"I didn't realise I had lost the ring till I was at home. (Italy; B1 THRESHOLD; 2000; Italian; Pass)

I didn't trust him. (Spain; B1 THRESHOLD; 2006; Spanish - European; Pass)

[talking about a spare television] ? we had one in the garage that we did not use. (Mexico; B1 THRESHOLD; 2001; Swedish; Pass)"
615;PAST;past simple;B1;FORM;FORM: QUESTIONS  ;Can use 'yes/no', 'wh-', tag and negative question forms with a limited range of verbs.;"Did you receive my present? (B1 THRESHOLD; 2003; Pass)

How did you spend your weekend? (Uzbekhistan (Republic of); B1 THRESHOLD; 2009; Russian; Pass)

Why didn't he call me? (Brazil; B1 THRESHOLD; 2004; Portuguese; Pass)

We arranged to meet each other next Tuesday at 11 o'clock, didn't we? (Russia; B1 THRESHOLD; 2008; Russian; Pass)

Didn't you spend your last holiday with them as well? (Korea, North; B1 THRESHOLD; 2008; Korean; Pass)"
620;PAST;present perfect continuous;B1;FORM;FORM: AFFIRMATIVE;Can use the affirmative form.;"I have been thinking about your letter. (Spain; B1 THRESHOLD; 2008; Spanish - European; Pass)

We've been studying together since grade one. (Vietnam; B1 THRESHOLD; 2009; Vietnamese; Pass)

The letter was from my brother, who has been living in New York since he graduated from university. (Turkey; B1 THRESHOLD; 2008; Turkish; Pass)"
621;PAST;present perfect continuous;B1;FORM;FORM: QUESTIONS;Can use the question form with a limited range of verbs. ;"Have you been thinking about it a lot?! (Italy; B1 THRESHOLD; 2008; Italian; Pass)

What have you been doing? (China; B1 THRESHOLD; 2003; Chinese; Pass)

[talking about musical instruments] ? how long have you been playing them? (Bangladesh; B1 THRESHOLD; 2010; Bengali; Pass)"
626;PAST;present perfect simple;B1;FORM;FORM: AFFIRMATIVE;Can use the affirmative forms with a range of pronouns and nouns and an increasing range of verbs.;"I've left some clothes at the dry cleaner's 100 yards from my home, in Park Street. (B1 THRESHOLD; 2009; Mandarin; Pass)

It's been an amazing week for me. (Spain; B1 THRESHOLD; 2008; Spanish - European; Pass)

She is from California, but she has just moved to Italy. (Italy; B1 THRESHOLD; 2002; Italian; Pass)

Our company has signed deals with a few German companies. (India; B1 THRESHOLD; 2006; Panjabi; Pass)"
627;PAST;present perfect simple;B1;FORM;FORM: NEGATIVE;Can use the negative forms with a range of pronouns and an increasing range of verbs. ;"He hasn't spoken to anyone from that time till now. (Iran; B1 THRESHOLD; 2004; Farsi; Pass)

She is a quiet person so she has not made a lot of friends. (China; B1 THRESHOLD; 2000; Chinese; Pass)

We haven't decided where to go yet, but probably it will be to somewhere like Australia or New Zealand. (Brazil; B1 THRESHOLD; 2008; Portuguese; Pass)"
628;PAST;present perfect simple;B1;FORM;FORM: NEGATIVE QUESTIONS;Can use the negative question form. ;"Haven't you seen it yet? (Argentina; B1 THRESHOLD; 2002; Spanish - Latin American; Pass)

Haven't your parents given you their advice? (Spain; B1 THRESHOLD; 2008; Spanish - European; Pass)"
629;PAST;present perfect simple;B1;FORM;FORM: WITH ADVERBS;Can use the present perfect simple with an increasing range of adverbs in the normal mid position. ;"This is a famous seafood restaurant, you know, I've always loved seafood. (Mexico; B1 THRESHOLD; 2005; Spanish - Latin American; Pass)

Have you ever been to Gorgeousbi? (Korea, North; B1 THRESHOLD; 2005; Korean; Pass)"
633;PREPOSITIONS;prepositions;B1;FORM;FORM: SIMPLE;Can use a wide range of simple (single word) prepositions.;"If it is raining, the rain enters through the holes in the roof and makes the house wet. (B1 Fulani)

To my surprise, there was a charming beach along the cycle route. (B1 Chinese)

Don't forget to meet me at the theme park beside the main entrance. (B1 Albanian)

In the middle of the room there is a big bed between two windows and above the bed there is a beautiful painting. (B1 Swedish)

I think Bremen won't change that much within the next 20 years. (B1 German)

I hate shopping via the internet. (B1 Arabic ? Meghreb)"
634;PREPOSITIONS;prepositions;B1;FORM;FORM: COMPLEX;Can use an increasing range of complex prepositions.;"My parents weren't happy when they heard that I wanted to go to Croatia with my friends instead of flying to the USA. (B1 German)

The company chose my school thanks to the excellent results of the students. (B1 French)

It was saying that some company can find me a job in the UK and I can earn up to £ 1000 per month. (Poland; B1 THRESHOLD; 2004; Polish; Pass)

[talking about a watch] I was going out of the shop when I noticed that I had lost it. (B1 Italian)

I would like to apologise because, due to a dental appointment, I will not be able to participate in the English class tomorrow. (B1 French)

The best place to stay is a hotel a bit outside of the city. (B1 Swiss German)"
635;PREPOSITIONS;prepositions;B1;FORM;FORM: 'ADVERB' + PREPOSITION;Can use adverbs of degree to modify prepositions and prepositional phrases. ;"It's quite near my house so I can go there easily. (Italy; B1 THRESHOLD; 2003; Italian; Pass)

When I was trying to reach the only frame of light I could see in the woods, something moved right behind me. (Argentina; B1 THRESHOLD; 2009; Spanish - Latin American; Pass)

I'm going to put it right in front of the window, so I have enough light. (Germany; B1 THRESHOLD; 2009; German; Pass)

I felt I was flying and it was really like a dream. (Iran; B1 THRESHOLD; 2003; Farsi; Pass)

But anyway it's enjoyable to shop for clothes  especially with a group of friends. (Iran; B1 THRESHOLD; 2006; Farsi; Pass)"
636;PREPOSITIONS;prepositions;B1;FORM;FORM: STRANDING;Can end a reported question clause and a relative clause with a preposition, where the preposition is stranded from its complement. ► Clauses: relative;"So this is the best festival I been to. (B1 THRESHOLD; 2008; Albanian; Pass)

Please give him all the information he asks for. (Switzerland; B1 THRESHOLD; 2005; German; Pass)

Everybody should see which company I work for. (other; B1 THRESHOLD; 2004; Others; Pass)"
641;PRESENT;present simple;B1;FORM;FORM: QUESTIONS;Can use 'yes/no' and 'wh-' question forms with a wide range of subjects.;"Does your brother go with your parents? (Preliminary English Test, B1, German)

Which programmes do we like to watch? (B1 Farsi)

Where do they want to spend their holidays? (Preliminary English Test, B1, German)

How does he know my name? (Preliminary English Test, B1, Spanish ? Latin American)"
645;PRONOUNS;possessive;B1;FORM;FORM: + 'OF YOURS' ;Can use the possessive pronoun 'yours' after noun + 'of'.;"Maybe you can take a friend of yours with you there. (Preliminary English Test; B1; German)

I think that it's a very good idea of yours to come to the UK. (Skills for Life (Entry 3); Spanish)

You can ask some friends of yours to join you. (Preliminary English Test; B1; Greek)"
646;PRONOUNS;possessive;B1;FORM;FORM: COMPARATIVE CLAUSES WITH 'MINE', 'YOURS';Can use the possessive pronouns 'mine' and 'yours', with singular reference, in comparative clauses after '(not) as ... as'.;"Hope you have a friend as good as mine! (Preliminary English Test for Schools; Malaysia; B1 THRESHOLD; 2009; Chinese; Pass)

My bedroom is not as big as yours but it is lovely. (Preliminary English Test; Cyprus; B1 THRESHOLD; 2001; Turkish; Pass)

My town isn't very big, so I think it won't grow as fast as yours. (Preliminary English Test; Brazil; B1 THRESHOLD; 2007; Portuguese; Pass)

I hope [?] my English becomes as good as yours. (Preliminary English Test; Iran; B1 THRESHOLD; 2002; Farsi; Pass)"
647;PRONOUNS;possessive;B1;FORM;FORM: 'YOURS' AS SUBJECT;Can use the possessive pronoun 'yours', with singular reference, in subject position.;"We bought it because yours is very old and sometimes stops working. (Uruguay; B1 THRESHOLD; 2002; Spanish - Latin American; Pass)

I really needed some extra information, and yours was very useful. (Spain; B1 THRESHOLD; 2010; Catalan; Pass)"
