EGP_ID;SuperCategory;SubCategory;Level;Type;Guideword;Can-do statement;Example
816;MODALITY;expressions with be;B2;FORM;FORM: 'BE' EXPRESSIONS + INFINITIVE;Can use the full range of expressions with 'be' + infinitive ('be likely to', 'be due to', 'be meant to', 'be bound to', 'be sure to', 'be certain to', 'be obliged to') with present and past forms of 'be' and with modal 'will' .;"People who read books are likely to be more knowledgeable. (Argentina; B2 VANTAGE; 2008; Spanish - Latin American; Pass)

I'm bound to feel nervous. (France; B2 VANTAGE; 2000; French; Pass)

According to our new marketing strategy, we are sure to increase our turnover and our profit. (Austria; B2 VANTAGE; 2008; German; Pass)

[talking about a new job] I am due to start on Monday 4 June. (Georgia (Republic of); B2 VANTAGE; 2007; Georgian; Fail)

I would like to inform you that as of 1st of June all operational staff will be obliged to use identity cards. (Poland; B2 VANTAGE; 2006; Polish; Pass)

Sleepy and unwilling to take part of the conference, I was obliged to spend the evening listening to the soft voice of a man who was famous for his boring performances. (Italy; B2 VANTAGE; 1993; Italian; Pass)"
817;MODALITY;expressions with be;B2;FORM;FORM: 'BE' + ADJECTIVE + 'THAT';Can use 'be' + 'obvious/sure/likely/certain' followed by a 'that'-clause.;"It is about 1000 years old, so I am sure that you will find it fascinating to see it. (Japan; B2 VANTAGE; 2001; Japanese; Pass)

It was obvious that I would be late to work. (Greece; B2 VANTAGE; 2002; Greek; Pass)

It is likely that by reading books we will learn some new words and phrases so that we will be able to write better. (Poland; B2 VANTAGE; 2008; Polish; Pass)

It is certain that our state-of-the-art LCD will be well received and make great profits. (China; B2 VANTAGE; 2008; Chinese; Pass)"
831;MODALITY;may;B2;FORM;FORM: WITH ADVERBS;Can use 'may' with an increasing range of adverbs (most commonly 'even', 'only', 'already', 'never', 'just', 'sometimes') in the normal mid-position after the modal verb. ► adverbs;"When you're reading books, you may even find words you don't know and if you're an interested person, you will try to find out what it means, thus improving your vocabulary. (Portugal; B2 VANTAGE; 1993; Portuguese; Pass)

Think of all the children living in cities, they may never get the chance to come near any animals at all. (Nigeria; B2 VANTAGE; 1993; Swedish; Pass)"
836;MODALITY;must;B2;FORM;FORM: PAST AFFIRMATIVE;Can use 'must have' + '-ed'.;"When I realized that he must have forgotten, I called him up. (Chinese, B2 VANTAGE)

We had lots of fun learning how to ski. It was pretty hard at the beginning. I must have fallen about fifty times. (Brazil; B2 VANTAGE; 1993; Portuguese; Pass)
"
837;MODALITY;must;B2;FORM;FORM: QUESTIONS;Can use the question form.;"Is it possible to use the prize next year or must I cancel my trip to India? (Swedish, B2 VANTAGE)

Finally, how much money must I bring with me? (French, B2 VANTAGE)"
838;MODALITY;must;B2;FORM;FORM: WITH ADVERBS;Can use 'must' with an increasing range of adverbs (including 'all', 'never', 'strongly', 'first') in the normal mid position after the modal verb. ► adverbs;"To sum up, we must all act immediately because the existence of humanity may be in danger. (Greek, B2 VANTAGE)

But there is one, just one thing we must never forget: we have to be authentic. (Peru; B2 VANTAGE; 2008; Spanish - Latin American; Pass)

[talking about a guide book] In addition I must strongly recommend you add something about nightlife. (Russia; B2 VANTAGE; 2002; Russian; Pass)"
844;MODALITY;need;B2;FORM;FORM: NEGATIVE;Can use the negative form.;"You needn't worry about where we can stay. (China; B2 VANTAGE; 1998; Chinese; Pass)

 … when I send an e-mail, I need not worry about the time. (Japan; B2 VANTAGE; 2000; Japanese; Pass)

You needn't go out jogging in the evening because you have already had your exercise. (Sweden; B2 VANTAGE; 1993; Swedish; Pass)"
846;MODALITY;ought;B2;FORM;FORM: ELLIPSIS;Can use 'ought to' without a following verb where the previous main verb is understood. ► ellipsis;"Otherwise some students would not get as much specialised help as they ought to. (Germany; B2 VANTAGE; 2010; German; Pass)"
848;MODALITY;should;B2;FORM;FORM: ELLIPSIS ;Can use 'should' and 'shouldn't' without a following verb where the previous main verb is understood.;"Well, have you ever checked your blood pressure? I think you should. (Italy; B2 VANTAGE; 1993; Swedish; Pass)

John spent the rest of the day thinking about what he should do. in fact, he wanted to answer and meet her again, but he knew that he shouldn't. (Spain; B2 VANTAGE; 2004; Spanish - European; Fail)"
849;MODALITY;should;B2;FORM;FORM: 'SHOULD BE' + '-ING';Can use 'should be' + '-ing'.;"Well, you should be bouncing up and down with joy (just kidding)! (Spain; B2 VANTAGE; 2004; Spanish - European; Pass)

These are the reasons that I believe we should be reading books instead of watching television in our free time and I believe many people believe the same thinks as I do. (Greece; B2 VANTAGE; 1993; Greek; Pass)"
852;MODALITY;used to;B2;FORM;FORM: ELLIPSIS;Can use 'used to' without a following verb where the previous main verb is understood. ► ellipsis;"She doesn't travel as much as she used to. (Argentina; B2 VANTAGE; 1999; Spanish - Latin American; Pass)

I must admit that they did sound quite a lot better than they used to. (Denmark; B2 VANTAGE; 1999; Danish; Pass)"
855;NOUNS;noun phrases;B2;FORM;FORM: NOUN + 'OF' + POSSESSIVE DETERMINER + NOUN ;Can form noun phrases with noun + 'of' + possessive determiner + noun + '‘s', particularly with 'friend' or 'friends'.;"Actually, I know a great one and they can make a little discount for us because the owner is a friend of my father's. (Albania; B2 VANTAGE; 2009; Albanian; Pass)"
856;NOUNS;noun phrases;B2;FORM;FORM: POSSESSION WITH PLURAL NOUNS  + ';Can form noun phrases with plural nouns + ' + noun.;"He had promised that he would go to his grandparents' house this afternoon. (Greece; B2 VANTAGE; 2009; Greek; Pass)

Our company is a digital company with 15 years' experience. (China; B2 VANTAGE; 2008; Chinese; Pass)

It is essential to introduce special offers to get customers' attention. (India; B2 VANTAGE; 2009; Telugu; Fail)"
857;NOUNS;noun phrases;B2;FORM;FORM: POSTMODIFYING WITH ADJECTIVE PHRASE;Can form complex noun phrases by using adjective phrases as postmodifiers to give more information about the noun.;"Besides, we could leave one day in the morning and go by boat to a small and exotic island full of different and exotic species of birds that we could observe and photograph. (Turkey; B2 VANTAGE; 1993; Portuguese; Pass)

Emily Brönte succeeded in writing a romantic, psychological and tragic story, beautifully set in these mysterious moors. (Netherlands; B2 VANTAGE; 2001; Dutch; Pass)"
858;NOUNS;noun phrases;B2;FORM;FORM: COMPLEX NOUN PHRASES WITH ADJECTIVES COMBINED WITH 'BUT';Can form an increasing range of complex noun phrases with more than one adjective combined with 'but'. ;"I am very lucky, because I was born in a small but beautiful city called Neuva Helvecia. (Uruguay; B2 VANTAGE; 2003; Spanish - Latin American; Pass)


As a result, in order to find out which is the most important, you need to ask yourself a simple but tricky question that no man would like to be asked. (Greece; B2 VANTAGE; 2008; Greek; Pass)

The smoke in the air had a strong but good smell. (Brazil; B2 VANTAGE; 1993; Portuguese; Pass)

I will be on business in London to sign a contract with a new but significant customer at that time. (China; B2 VANTAGE; 2002; Chinese; Pass)"
859;NOUNS;types;B2;FORM;FORM'-ING' FORMS, SUBJECT;Can use the '-ing' form of verbs as nouns in subject position.  ;"Working until midnight every evening is not reasonable. Working late is not the solution and it is even dangerous. (France; B2 VANTAGE; 1993; French; Pass)

Also, think about stress. Driving in a city is stressful. (Germany; B2 VANTAGE; 1993; German; Pass)

First of all, Wicklow Mountains Centre is the perfect place for climbing. Climbing is our favourite hobby and, I think, we will have a good time. (Greece; B2 VANTAGE; 2007; Greek; Pass)

Many people say that they just don't have time for thinking about their health. Living in today's world demands spending a lot of time working. (Poland; B2 VANTAGE; 1999; Polish; Pass)"
860;NOUNS;uncountable;B2;FORM;FORM: NO ARTICLE;Can use uncountable nouns without a definite article to refer to an abstract thing in general. ;"Television is more attractive because it has moving images. (Portugal; B2 VANTAGE; 1993; Portuguese; Pass)

Music was her life, not only a hobby. (Spain; B2 VANTAGE; 1999; Catalan; Pass)

Look at it this way, the more you work in school, the more you will achieve in your job. Education is important to prevent you from being a dog on a leash! (Germany; B2 VANTAGE; 2010; German; Pass)

Language can be learned slowly and reflects the culture and tradition of the country. Language even plays an important role in the tourist industry. (Nepal; B2 VANTAGE; 2011; Nepali)"
861;PASSIVES;passives: form;B2;FORM;FORM: INFINITIVE;Can use the passive infinitive affirmative and negative forms after an increasing range of main verbs, modal verbs, adjectives and nouns, in impersonal constructions. ;"According to your advertisement, some training is supposed to be given. (B2 South Korean)

My composition was ready to be printed and I was searching for a piece of paper? (B2 Austria)

I would prefer to sleep in a tent because I have never done it and I think it is an experience not to be missed, a very original adventure! (B2 French)

The reason that I took part in your research was to help youngsters not to be addicted to computer games ?  (B2 Greek)

For one, the future homes might not be built out of bricks at all! (Korea, South; B2 VANTAGE; 2000; Korean; Pass)"
862;PASSIVES;passives: form;B2;FORM;FORM: MODAL PERFECT ;Can use the present perfect simple affirmative and negative forms with modal verbs to refer to the past.;"I think that all these problems could have been avoided and that asking for my money back is the best way of forgetting that evening. (B2 Catalan)

I don't remember how I lost it, it might have been stolen. (B2 Japanese)

Of course, some groups were better than others but I think they all played well and have talent: they should have been given a chance! (B2 Italian)

It should not have been used in this kind of article. (B2 Korean)"
863;PASSIVES;passives: form;B2;FORM;FORM: PAST CONTINUOUS AFFIRMATIVE. ;Can use the past continuous passive affirmative. ;"However, to my disappointment, the restaurant was closed because it was being redecorated. (B2 Chinese)

After they explained everything to him, he then knew he was being tricked by them and that this was supposed to be a special experience for him. (B2 Chinese) 

We thought that as you lived there, we could go to your house and stay there while the car was being repaired. (B2 Basque)"
864;PASSIVES;passives: form;B2;FORM;FORM: PAST PERFECT SIMPLE, AFFIRMATIVE ;Can use the past perfect passive affirmative form.;"The car had been serviced and everything seemed to be all right. (B2 Portuguese)

At this moment, Lime walked in and realised he had been set up. (B2 Dutch)"
865;PASSIVES;passives: form;B2;FORM;FORM: PAST PERFECT SIMPLE, NEGATIVE ;Can use the past perfect passive negative form.;"[talking about a car] In fact, it hadn't been stolen, it had been taken by a man and his wife, because their car broke down and because she was about to have her baby ? (B2 Portuguese)

We waited for ages because we had not been informed. (B2 Japanese)"
866;PASSIVES;passives: form;B2;FORM;FORM: PAST SIMPLE NEGATIVE;Can use past simple passive negative. ;"What is worse, the ticket price was not reduced despite the fact that I showed my student ID. (B2 Japanese)

I had to go to the hospital because my back hurt so badly, and I wasn't allowed to work for two weeks. (B2 Hungarian)

I was really disappointed because a lot of things were not done. (Turkey; B2 VANTAGE; 2000; Turkish; Pass)

Some say that studying animals would be impossible, if they weren't kept in zoos ? (B2 Italian)"
867;PASSIVES;passives: form;B2;FORM;FORM: PRESENT CONTINUOUS, AFFIRMATIVE ;Can use the present continuous passive affirmative with an increasing range of verbs.;"This year's topic is the online training for employees, which is being relaunched . (2786698_1; BECV; Germany; B2 VANTAGE; 2010; German; Pass)
The global temperature is rising, the ice is melting, the sea level increases and miles and miles of coast are being submerged. (B2 VANTAGE; 1993; Portuguese; Pass)

The first thing to be linked through computers was academic knowledge, then came commercial businesses, naturally, and now, people are being linked through billions of personal computers. (Korea, South; B2 VANTAGE; 1999; Korean; Pass)"
868;PASSIVES;passives: form;B2;FORM;FORM: PRESENT CONTINUOUS, NEGATIVE;Can use the present continuous passive negative.;"? students are not being educated equally. (Mongolia; B2 VANTAGE; 2008; Mongolian; Pass)

To conclude, in my opinion, it is important to keep as many languages as possible alive, so we can make sure that part of the human history is not being lost. (Brazil; B2 VANTAGE; 2011; Portuguese)

Firstly, the fact of different kinds of animals are in a zoo, doesn't means that they aren't being treated right. (Brazil; B2 VANTAGE; 1993; Portuguese; Fail)"
869;PASSIVES;passives: form;B2;FORM;FORM: PRESENT PERFECT SIMPLE, AFFIRMATIVE ;Can use the present perfect passive affirmative form (often in the context of reporting).  ► reported speech;"I have been asked to write a report about an accident which happened to me last Saturday. (B2 Polish)

I am writing to you to give you further information about the conference organization and about the arrangements which have been made for your group of students. (B2 Italian)"
870;PASSIVES;passives: form;B2;FORM;FORM: PRESENT PERFECT SIMPLE, NEGATIVE ;Can use the present perfect passive negative form (often in the context of reporting). ► reported speech;"?the old-fashioned house which has not been used for twenty years is not a very attractive sight from our town either. (B2 Danish)

This happened two years ago, and the necklace hasn't been found yet ? (B2 Spanish - European)"
871;PASSIVES;passives: form;B2;FORM;FORM: WITH MODAL VERBS;Can use the passive with modal verbs in a range of contexts, with a variety of subjects.;"Architects should be hired to design parks, where people could go for a walk or have a picnic. (B2 Polish)

Although I had a marvellous time, I believe there are a few things that could be improved for next year's festival. (Greece; B2 VANTAGE; 2001; Greek; Pass)

As a result, today, it could be said that nearly everyone is living in a digital world which means computers are necessary and very important. (China; B2 VANTAGE; 1999; Chinese; Pass)"
872;PASSIVES;passives: form;B2;FORM;FORM: WITH VERBS TAKING TWO OBJECTS, , WITH PREPOSITIONAL PHRASE;Can use the passive with a range of tenses and verbs needing two objects (e.g. give, offer, sell) with the direct object in subject position and the indirect object in a prepositional phrase. ;"Your name was given to me by a member of yours, Allan Westwood, whom I met last week. (Sweden; B2 VANTAGE; 1993; Swedish; Pass)

If more training is given to staff, they will be interested in their work  and staff turnover will be reduced. (India; B2 VANTAGE; 2006; Tamil; Fail)

Unfortunately an interview for a job in the New Palace Hotel has been offered to me at the same time as your class. (Spain; B2 VANTAGE; 2003; Spanish - European; Pass)
"
873;PASSIVES;passives: form;B2;FORM;FORM: WITH VERBS TAKING TWO OBJECTS.;Can use the passive with a wide range of verbs needing two objects, putting the indirect object in subject position. ;"I was very happy to hear that you have been offered two jobs, one in a restaurant and one in a museum. (Greece; B2 VANTAGE; 2001; Greek; Pass)

[talking about a music contract] She was offered a contract to record a single. (Mexico; B2 VANTAGE; 2006; Spanish - Latin American; Pass)

First of all, I felt happy and pleased that your firm has been given some extra money to spend on improvements to the cinema next year. (Malaysia; B2 VANTAGE; 2006; Chinese; Pass)"
876;PASSIVES;get and have;B2;FORM;FORM: 'GET' + REFLEXIVE PRONOUN + '-ED';Can use a reflexive pronoun with the 'get'-passive. ;"Although to drive a car you must be very careful because you could get yourself killed if you don't drive carefully enough. (Portugal; B2 VANTAGE; 1993; Portuguese; Pass)

Although he has a charming personality he uses it to get himself involved in illegal activities. (Greece; B2 VANTAGE; 1993; Greek; Pass)"
879;PAST;past continuous;B2;FORM;FORM: WITH ADVERBS;Can use the past continuous with a wide range of adverbs in the normal mid position.;"My younger brother was constantly bothering me. (Russian, B2 VANTAGE, Pass, 1997)

One day, as she was wistfully walking in the dusk of that day, she told herself she could either go on living her lonely life or make a huge effort to fit in. (French, B2 VANTAGE, Pass, 2005)"
883;PAST;past perfect continuous;B2;FORM;FORM: NEGATIVE;Can use the negative form. ;"Laura realised that she had not been studying very hard lately. (Malaysia; B2 VANTAGE; 1999; Chinese; Pass)

I couldn't tell her about Mark because she hadn't been doing anything else but talking about him for the last three weeks. (Netherlands; B2 VANTAGE; 1993; Dutch; Pass)

Last week, two of your employers came to solve the problems of my central heating system as it had not been working for two days. (Romania; B2 VANTAGE; 2010; Romanian; Pass)"
884;PAST;past perfect continuous;B2;FORM;FORM: WITH ADVERBS;Can use the past perfect continuous with adverbs in the normal mid position. ;"I had been working hard at my job and I had really been looking forward to this holiday. (Sweden; B2 VANTAGE; 1993; Swedish; Pass)

When he died, he was a rich man, he had only been living ten months in the house he had built for fourteen years ? (France; B2 VANTAGE; 1999; French; Fail)"
890;PAST;past perfect simple;B2;FORM;FORM: ELLIPSIS ;Can leave out the subject before the past perfect simple where it is understood from the previous clause.;"But now she felt stronger and had lost her fear. (France; B2 VANTAGE; 1993; French)

Simon was a very famous writer and had written ten best-sellers. (Greek; Greece; B2 VANTAGE; Pass; 2009)

All her friends from Chicago had come to visit her and had brought a huge chocolate cake with them. (Spain; B2 VANTAGE; 1993; Spanish - European)

They were cold and had gone numb. (Korea, South; B2 VANTAGE; 1999; Korean)"
891;PAST;past perfect simple;B2;FORM;FORM: QUESTIONS;Can use question forms.;"Had I made the same mistake twice? (B2; 1993; German; Pass)

? the question was: Why had he done that? (Spain; B1 THRESHOLD; 2008; Spanish - European; Pass)"
892;PAST;past perfect simple;B2;FORM;FORM: WITH ADVERBS;Can use the past perfect simple with a wide range of adverbs (including 'finally', 'recently', 'simply') in the normal mid-position.  ► adverbs;"He had finally achieved his goal! (Greece; B2 VANTAGE; 2009; Greek; Pass)

She had suddenly woken up at that noise, but now was trying to persuade herself it was just a dream. (Italy; B2 VANTAGE; 1999; Italian; Pass)

And had all the furniture and David's personal things been stolen by thieves or had they just simply disappeared? (Greece; B2 VANTAGE; 2006; Greek; Pass)"
897;PAST;past simple;B2;FORM;FORM: NEGATIVE;Can use the negative form with a wide range of regular and irregular verbs.;"I didn't hesitate and went there straight away. (Poland; B2 VANTAGE; 2004; Polish; Pass)

I'm sure it wasn't my fault as I didn't switch anything on or off at that moment. (France; B2 VANTAGE; 1993; French; Pass)

? we really enjoyed our holiday even though things did not turn out they way we planned. (Sweden; B2 VANTAGE; 1993; Swedish; Pass)"
898;PAST;past simple;B2;FORM;FORM: QUESTIONS;Can use 'yes/no', 'wh-', tag and negative question forms with an increasing range of verbs.;"Are you still looking for a job or did you succeed in finding one? (France; B2 VANTAGE; 1993; French; Pass)

When did you last see your wife and your children? (Germany; B2 VANTAGE; 1993; German; Pass)

It was great to have met you, and we certainly had a terrific time together, didn't we? (Portugal; B2 VANTAGE; 1993; Portuguese; Pass)

Didn't you tell me that you had to go to Orleans today? (B2 VANTAGE; 1993; French; Pass)

Why didn't you say something about it? (Argentina; B2 VANTAGE; 2000; Spanish - Latin American; Pass)
"
899;PAST;past simple;B2;FORM;FORM: WITH SUBORDINATING CONJUNCTIONS;Can use the past simple with a range of subordinating conjunctions, including 'as soon as', 'before', 'if', 'once', 'since', 'so', 'until', 'when', 'while'.;" ? as soon as we went down to around 15 metres in depth, we saw a lot of coloured fish. (B2, French)

I told you about that terrible hotel I had stayed in before I came to visit you. (B2, German)

Once he got inside, he started searching for some clues to that horrible crime. (B2, Italian)"
900;PAST;past simple;B2;FORM;FORM: WITH TIME ADJUNCTS;Can use a range of time adjuncts with the past simple.;"I also worked as a helper on a summer camp for primary schoolchildren in Canada last summer. (B2, Japanese)

I can remember one which happened to me last year, during the Christmas holiday. (B2, Italian)

He worked hard for quite a long time to earn the money he needed. (B2, Greek)"
903;PAST;present perfect continuous;B2;FORM;FORM: NEGATIVE;Can use the negative form.;"I hope that I have not been wasting your time and giving you too much trouble. (Malaysia; B2 VANTAGE; 1997; Chinese; Pass)

Hope you haven't been working too hard! (Japan; B2 VANTAGE; 2000; Japanese; Pass)

The heating system has not been working properly since your staff completed the work in my house. (Turkey; B2 VANTAGE; 2010; Turkish; Pass)"
904;PAST;present perfect continuous;B2;FORM;FORM: WITH ADVERBS;Can use the present perfect continuous with adverbs in the normal mid position. ;"I have just been reading an article in your newspaper this morning, about The Westfield Music Festival. (Sweden; B2 VANTAGE; 1997; Swedish; Pass)

I've also been singing in a choir for five years, so I'm very familiar with it. (Sweden; B2 VANTAGE; 2000; Swedish; Pass)

You have already been complaining about headaches and insomia. (Poland; B2 VANTAGE; 1993; Polish; Pass)"
907;PAST;present perfect simple;B2;FORM;FORM: QUESTIONS;Can use the question form with an increasing range of verbs.;"How has your family been? (Mexico; B2 VANTAGE; 2000; Spanish - Latin American; Pass)


But what have these animals done? (Netherlands; B2 VANTAGE; 1993; Dutch; Pass)

In 1970 people in the UK married in their early 20s, but nowadays they marry at the end of their 20s. But why has this changed? (B2 VANTAGE; 2008; German; Pass)"
908;PREPOSITIONS;prepositions;B2;FORM;FORM: COMPLEX;Can use a wide range of complex prepositions.;"She did not say very much except for ""oh"" and ""yes, yes"" every once in a while. (B2 Dutch)

[talking about animals in zoos] And it gives them the possibility of gradually gaining knowledge about other living creatures apart from humans. (B2 Polish)

[giving suggestions on how to make the reception area of a school more attractive] It is based on my personal opinions in addition to a sample of 500 people who are students and staff at the school, and also visitors. (B2 French)

Now, as for the camping, I admit that I'm not a great fan of it. (B2 Greek)

I hope that, in spite of some small problems, people liked the festival and we will be able to attend it next year. (B2 Russian)"
912;PRESENT;present simple;B2;FORM;FORM: INVERSION WITH 'NOT ONLY ... BUT ALSO';Can use the inverted form of the past simple with auxiliary 'do', in the phrase 'not only ... but also'.;"Not only do they save you filing time, but also they save office space. (First Certificate in English, B2, Chinese)

Not only does it look nice but it's also full of places that we should visit, such as the enormous old castle or the extremely fascinating butterfly farm!! (First Certificate in English, B2, Italian)"
915;PRONOUNS;possessive;B2;FORM;FORM: +  'OF OURS';Can use the possessive pronoun 'ours' after noun + 'of'.;"Finally we went to Venice where we met some friends of ours and spent with them the rest of the holiday. (Italy; B2 VANTAGE; 1993; Italian; Pass)

The credit crunch is heavily affecting this region, therefore all retail sales have fallen and many competitors of ours are decreasing their sales too. (Italy; B2 VANTAGE; 2009; Italian; Pass)

Paul, a classmate of ours, will be the D.J. and we are thinking of listening to rock music, since Mr. Brown likes it. (Greece; B2 VANTAGE; 2000; Greek; Pass)"
916;PRONOUNS;possessive;B2;FORM;FORM: COMPARATIVE CLAUSES WITH 'OURS', 'HERS';Can use the possessive pronouns 'hers' and 'ours' in comparative clauses.;"I told my mother that your Spanish omelette is better than hers. (First Certificate in English; B2; Spanish ? European) 

Lots of changes which may occur during the next fifty years can make us fear that our sons' and grandsons' lives will not be as happy as ours. (Switzerland; B2 VANTAGE; 2002; French; Pass)"
